title;link
Fim da espera para Cuca? Atacante é liberado para assinar com o Atlético-MG e deve chegar amanhã em BH;Atleticomg.net
No Atlético-MG, zagueiro celebra primeiro gol no profissional e revela dica de ídolo do clube;Globo
Atlético empata com o Democrata GV no Mineiro;Clube Atlético Mineiro
Orlando City x Atlético-MG: horário e onde assistir ao jogo da FC Series;CNN Brasil
Cuca reprova contratação e Atlético-MG cancela negociações pela chegada de Luizão, do West Ham;Bolavip Brasil
13 fotos da classificação na Copa do Brasil;OneFootball -  Português do Brasil
Atlético-MG x Democrata no Campeonato Mineiro: onde assistir ao vivo, horário e escalação;Estadão
‘Luis Castro é perfeito para assumir o Atlético-MG’, analisa Denílson;Band Jornalismo
Pouco inspirado, Atlético-MG empata mais uma pelo Campeonato Mineiro;LANCE!
“Um dos piores……..”: Edu Panzi ‘solta o verbo’ após Atlético-MG x Democrata no Mineirão;Atleticomg.net
Entenda por que Atlético-MG se anima com possível chegada de Neymar ao Santos;Globo
Ainda sem titulares, Atlético-MG empata com Democrata-GV pelo Mineiro;CNN Brasil
Por onde anda Guilherme, ídolo do Atlético-MG?;LANCE!
Atlético-MG registra segundo pior público como mandante no Mineirão desde 2013  veja;Globo
Com Arena MRV, Atlético-MG prepara material para anunciar 'grande reforço'  afirma jornalista;Atleticomg.net
Atlético-MG: técnico vê evolução no time que disputa o Mineiro;LANCE!
Atacante do Atlético-MG recebe proposta milionária da Arábia para deixar o clube;Atleticomg.net
Últimos vídeos do Atlético-MG;Globo
Vídeos do Atlético-MG na TV;Globo
Análise: base do Atlético-MG segura resultado, mas tiro curto do Mineiro pode atrapalhar planos do hexa;Globo
No Vasco, Tchê Tchê reencontra Jair, parceiro de cinco títulos no Atlético-MG  veja números da dupla;Globo
Atuações do Atlético-MG: Gabriel Delfim tem boa atuação, e ataque deixa a desejar  veja notas e avalie;Globo
Robert Santos revela motivos que fizeram ficar no Atlético-MG: "Por isso eles compraram";Atleticomg.net
Atlético-MG leva gol com 37s, empata, mas segue sem vencer no Mineiro;UOL Esporte
Galo x Democrata: coletiva de imprensa com Dalla Déa;Clube Atlético Mineiro
Ao vivo - Atlético-MG x Democrata-GV - Mineiro 2025 - Acompanhe todos os lances;Band Jornalismo
"Se fosse..........": Robert Santos 'aparece' nas redes sociais e responde críticas pelo seu desempenho;Atleticomg.net
Luanderson, do Democrata, desabafa após empate contra o Atlético no Mineiro: “só a gente sabe da nossa situação”;Globo
Atlético-MG faz consulta e tenta convencer Bruno Henrique a deixar o Flamengo;GOAL Brasil
Dudu comemora 1º gol pelo Galo: "Momento único";Clube Atlético Mineiro
Atlético-MG tenta levar Bruno Henrique do Flamengo: entenda a estratégia;Monitor do Mercado
A pedido de Cuca, Atlético-MG toma decisão a respeito da chegada do zagueiro Luizão do West Ham;Atleticomg.net
Pouso Alegre abre venda de ingressos para jogo contra o Atlético-MG, pela 3ª rodada do Campeonato Mineiro;Globo
Atlético-MG: Everson planeja realizar sonho no clube;Gávea News
Atlético-MG enfrenta desafio de atrair torcedores no Mineirão: números preocupam! Confira!;Jornal Diário do Estado
Camisa All Black para quem é GVN Forte e Vingador!;Clube Atlético Mineiro
Salário de Eduardo Vargas no Nacional será superior ao que ganhava no Atlético-MG  veja valores;Atleticomg.net
Informações do treino do Galo nos EUA (22/1);Clube Atlético Mineiro
Atlético-MG empata com o Democrata pelo Campeonato Mineiro;Terra
Campeonato Mineiro 2025: Atlético-MG perde atacante com lesão muscular para a sequência do torneio;Atleticomg.net
"Chorou muito": Humorista revela conversa emocionante com Júnior Santos após acerto com o Atlético-MG;Atleticomg.net
Sem corneta exagerada, mas rendimento da base do Galo reforça necessidade de o clube ir ao mercado;O Tempo
Dalla Déa analisa empate do Atlético: 'conseguimos melhorar algumas questões';Terra
Lyanco responde provocação de Gabigol na reapresentação do Atlético-MG;Band Jornalismo
Atlético só empata com Democrata (MG) e Cruzeiro perde com gol contra da Fabrício Bruno;JM Online
Atlético-MG: Eduardo Vargas é anunciado por novo clube;Gávea News
Ex-Atlético, Vargas diz que ‘se cansou’ do futebol brasileiro em chegada a novo clube;No Ataque
Athletic x Cruzeiro pelo Campeonato Mineiro: onde assistir ao vivo, horário e escalação;Estadão
Apesar da dificuldade, Atlético-MG ainda tenta contratar Bruno Henrique;OneFootball -  Français
Atlético-MG: Zagueiro Dudu marca seu primeiro gol e revela dica de ídolo, em preparação para próximos desafios no Mineirão;Jornal Diário do Estado
Mineiro: zebra passeia no Mané e Cruzeiro acaba derrotado pelo Athletic-MG;Distrito do Esporte
Craque Neto se rende a novo reforço do Atlético-MG: "Melhor que o Paulinho";Atleticomg.net
Hoje tem Flamengo x Atlético-MG no Campeonato Brasileiro;Band Jornalismo
Após deixar o Atlético-MG, Eduardo Vargas é anunciado pelo Nacional do Uruguai;Bolavip Brasil
Atlético-MG x Democrata: onde assistir ao vivo e as escalações do jogo de hoje (22/01) pelo Mineiro;OLiberal.com
Atlético-MG leva gol com 37s, empata, mas segue sem vencer no Mineiro;UOL Esporte
Quem é Dudu, zagueiro que marcou 1º gol do Atlético em 2025?;No Ataque
Jogadores do Atlético-MG visitam parque em Orlando na folga;Globo
Galo x Democrata: coletiva de imprensa com Dalla Déa;OneFootball - English
Com time alternativo, Atlético-MG empata com Democrata e segue sem vencer no Mineiro;Resultados
Herói contra o Democrata, zagueiro Dudu manda recado para a torcida do Galo;Bolavip Brasil
Acerto entre Bruno Henrique e Flamengo impede ida para o Atlético-MG.;Torcida Flamengo
"Muitos erros........": Guilherme Dalla Déa comenta atuação da equipe após empate 1 a 1 no Mineirão;Atleticomg.net
GOL DO ATLÉTICO-MG! Gol de Deyverson!;Band Jornalismo
Reforço do Atlético-MG, Natanael revela qual sua principal qualidade: "É fundamental";Atleticomg.net
GOL DO ATLÉTICO-MG! Gol de Paulinho!;Band Jornalismo
Inscrições para o Treinão de Aniversário do Galo;OneFootball - Deutsch
Cruzeiro supera o Atlético Mineiro, revela comentarista Heverton Guimarães: confira a análise;Bolavip Brasil
Informações dos treinos do Galo desta terça (21/1);OneFootball - Deutsch
Palmeiras e Atlético Mineiro buscam contratação de Gregore, do Botafogo;OneFootball -  Français
Clubes da Série A apostam em jovens no início dos Estaduais 2025  confira os desempenhos;Bahia Notícias - Esportes
Com gol contra de Fabrício Bruno, Cruzeiro perde para o Athletic no Mineiro;CNN Brasil
Matías Zaracho deixa o Galo;OneFootball -  Español
Empréstimo de Rabello e Palacios, chegada de Cuello e os jogadores mais antigo: as últimas notícias do Atlético-MG;Gávea News
Torcida do Atlético-MG zoa Fabrício Bruno após gol contra: "Lyanco acabou com o psicológico";Atleticomg.net
Everson abre o jogo sobre oferta do Bahia, Seleção e renovação com o Atlético;Terra
Os jovens do Atlético que aproveitaram bem a oportunidade contra o Democrata-GV;No Ataque
Robert lamenta tropeço do Atlético, mas destaca foco para próxima partida;Correio Braziliense
Atlético promove uma mudança na escalação para enfrentar o Democrata-GV;No Ataque
Bruno Henrique no Atlético-MG? Como o Flamengo encara assédio alvinegro pelo atacante;Trivela
Eduardo Vargas Revela Influência de Gareca em Sua Transferência para o Nacional do Uruguai;FootBoom
Atuações: Guilherme vai bem, e ataque do Flamengo responde com goleada  dê suas notas;Globo
Galo x Democrata: coletiva de imprensa com Dalla Déa;OneFootball -  Español
Atlético e Cruzeiro não vencem pelo Campeonato Mineiro nesta quarta;O Tempo
Pouso Alegre inicia venda de ingressos para jogo contra o Atlético-MG;Terra do Mandu
Denílson imagina final da Libertadores quente entre Botafogo e Atlético-MG;Band Jornalismo
Atacante Soteldo ‘domina’ o noticiário na manhã dessa quinta-feira (23)  entenda o motivo;Atleticomg.net
Robert faz autoavaliação sobre desempenho pelo Atlético no Mineiro: ‘Poucos erros’;No Ataque
Fabinho Soldado, do Corinthians, interessa a Atlético-MG e RB Bragantino;Band Jornalismo
Após deixar Atlético-MG, Vargas é anunciado pelo Nacional-URU;Futebol Interior
Deyverson, do Atlético, encontra ídolo nos EUA e se declara: ‘Sonho realizado’;No Ataque
atlético mineiro joga;Prefeitura de Marabá - Pa
Atlético registra segundo pior público como mandante desde a reinauguração do Mineirão;O Tempo
Cuca aprova Benjamín Rollheiser no Atlético-MG para jogar com Júnior Santos: “Tem o perfil”;Bolavip Brasil
Atlético: Destaque da equipe sub-20 que joga o Mineiro, Delfim projeta “última oportunidade”;O Tempo
Com gol de Dudu, Atlético-MG empata com o Democrata-GV e segue sem vencer no Mineiro;Atleticomg.net
Vitória toma chapéu de gigante sul-americano e perde ex-Atlético-MG;Trivela
Atlético-MG tropeça em casa com o Democrata e segue sem vencer no Campeonato Mineiro;GZH
Autor do gol de empate do Atlético contra o Democrata-GV revela conselhos de ídolo do clube;O Tempo
Ex-técnico de Atlético e Cruzeiro diz que vídeo íntimo com jogador de 16 anos é ‘armação’;No Ataque
