title;link
Tombense x Itabirito - Ao vivo - Campeonato Mineiro - Minuto a Minuto Terra;Terra
Tombense 1 x 0 Itabirito | Campeonato Mineiro: melhores momentos;Globo
Dr. Elio da Mata, prefeito de Itabirito, estará na estreia do programa “Terça em Foco” em entrevista ao vivo;Sou Notícia
Matheus Henrique é pilar do Cruzeiro, que enfrenta Itabirito em BH;Metrópoles
Prefeitura de Itabirito abre processo seletivo para estágios com bolsas de até R$ 1.518,00;Mais Minas
rádio cidade itabirito;Prefeitura de Marabá - Pa
itabirito x urt;ufrj.br
Jornal O Espeto Notícias;Jornal O Espeto
Itabirito joga mal e perde por 1×0 para o Tombense no Campeonato Mineiro;Radar Geral Itabirito
itabirito x urt;Helder Moura
Tombense vence Itabirito e se reabilita após estreia com derrota no Mineiro;Itatiaia
Cruzeiro é derrotado e Atlético só empata na segunda rodada do Campeonato Mineiro;sucessofm.com
Tombense vence Itabirito por 1 a 0 no Almeidão com gol de Jefferson Renan;Portal Miradouro
TOMBENSE VENCEU O ITABIRITO POR 1 A 0 NO ESTÁDIO ALMEIDÃO PELO CAMPEONATO MINEIRO;carangola noticias
Itabirito se destaca na geração de empregos por meio do Sine;Mais Minas
aymorés x itabirito;Prefeitura de Marabá - Pa
Internada no Hospital de Itabirito e esperando há 50 dias por cirurgia, paciente recorre 2 vezes à Justiça;Radar Geral Itabirito
Herculano Mineração anuncia vagas de emprego em Itabirito (MG) para diversos cargos;Mais Minas
Itabirito x Tombense: onde assistir, horário, escalações, saiba tudo sobre o confronto;Radar Geral Itabirito
Itabirito empossa Comissão de Ética de Enfermagem para fortalecer a saúde municipal;Mais Minas
Jornal O Espeto Notícias;Jornal O Espeto
Unidades avançadas do IFMG tornam-se "campus";Vestibular IFMG
Unidades avançadas do IFMG tornam-se "campus" — Instituto Federal de Educação, Ciência e Tecnologia de Minas Gerais Campus Ribeirão das Neves;Vestibular IFMG
Tombense e Uberlândia vencem e empurram Atlético para lanterna do Grupo A;No Ataque
Uberlândia conquista primeira vitória no Campeonato Mineiro 2025;Diário de Uberlândia
Jornal O Espeto Notícias;Jornal O Espeto
Cruzeiro desembarca hoje (21/1) em Brasília para jogo contra Athletic;O Seringal
Projeto Férias no Parque acontece na próxima semana em Itabirito;Jornal Geraes
Palpite: Tombense x Itabirito - Campeonato Mineiro 2025;APWin
Tombense conquista primeira vitória no Campeonato Mineiro 2025;Aconteceu no Vale
Campeonato Mineiro: Assista ao vivo e de graça ao jogo Tombense x Itabirito;TV Pop
Em Congonhas, trecho da Rua dos Cristais é interditada;Jornal Geraes
